{
  "$schema": "https://raw.githubusercontent.com/anthril/claude-memex/main/schemas/memex.config.schema.json",
  "version": "1",
  "profile": "book-companion",
  "root": ".memex",

  "allowedTopLevel": [
    "README.md",
    "AGENTS.md",
    "index.md",
    "log.md",
    "timeline.md",
    ".open-questions",
    ".rules",
    ".state",
    "raw",
    "wiki"
  ],

  "datedFolders": {
    "paths": [],
    "format": "DDMMYYYY-HHMM"
  },

  "readmeRequired": [
    "wiki/characters/*",
    "wiki/places/*",
    "wiki/themes/*",
    "wiki/plot-threads/*"
  ],

  "frontmatter": {
    "appliesTo": ["**/README.md", "**/AGENTS.md", "wiki/**/*.md"],
    "required": ["title", "slug", "type", "status", "created", "updated"],
    "enum": {
      "type": ["character", "place", "theme", "plot-thread", "summary", "open-question", "rule"],
      "status": ["draft", "active", "deprecated"]
    }
  },

  "naming": {
    "exceptions": ["README.md", "AGENTS.md", "CHANGELOG.md", ".resolved"]
  },

  "codeToDocMapping": [],

  "log": {
    "path": "log.md",
    "entryPrefix": "## [{date}] {event} | {subject}"
  },

  "index": {
    "path": "index.md",
    "sections": ["Characters", "Places", "Themes", "Plot Threads", "Chapter Summaries", "Open Questions", "Recent Activity"]
  },

  "search": {
    "engine": "grep",
    "maxContextPages": 3
  }
}
